,place_id,review_id_hash,rating,published_at_date,english_review,sentiment
464002,ChIJLeuZiNdXei4R0Cjf668P5a0,87c1bf9931ee3204849a55bc0dcca508,5,2023-05-14,cheap and delicious neighborhood pizza shop,1
298644,ChIJJYW21ouBdy4RsVKihUbJXP0,3207b05504a0a50d4b629933e3f3024e,5,2024-04-21,"its really delicious, no joke",1
7493,ChIJw96jvRz0aS4RSopgLLmBBdk,1aca3b42f50d01600c4d026566fcd419,5,2023-06-13,Caffe that makes visitors comfortable. The waiters are also friendly. Thank You,1
442627,ChIJ3bNCfAO3ey4R0dpI8Dl-QCQ,077a17cd5ee60d8d49a2463d3c823df2,5,2022-05-14,"An extraordinary place suitable for hanging out for all groups, whether young people or those with families. Suuuiiiipppp lah.... Always success for GARIN CAFE & RESTO...",1
250066,ChIJ4Vy94RKxby4R6XX5aA6zT58,fb27ea2f6a0d3223cd8514bc5ac0c8be,5,2023-05-14,Comfortable,1
332059,ChIJIajjBjANeC4RNckoFHdIr8k,f68a68e751f279135f835561d11d7424,5,2023-08-14,A reliable place if youre on assignment and need fast WiFi,1
430179,ChIJz1Ud6dJgei4RgBf54fjh4Qs,7512cbca321a22eb33ecc37daa854381,5,2023-05-12,"Thank God the place is friendly, cool quickly too",1
269924,ChIJdeEeXmXrei4RsDfK7lDokIU,d89e541ae4e61b164253b1668782f7a4,5,2023-08-14,"Anyway, great",1
278421,ChIJG7WNZpZFei4Rp4T1heXjo28,6f5ca74d3d272c3322aef8665dc4785c,5,2023-12-11,"It makes for a delicious meal, but perhaps the food part could be improved a bit, especially the salad, the pieces could be finer or thinner. Overall its okay",1
338002,ChIJgVzR_TQo1i0RJZr_IEE1MRk,6b2704c9a5ca98ba97eaf4d419df90ae,5,2024-02-14,mantaap,1
264445,ChIJwXvyBymNei4RgeViUWydePg,ec1a54ad0542d3ebb6a7dbe6fd1268e6,5,2023-05-14,"The place is nice, cool and relaxing. You can see rice fields and incised hills.",1
157332,ChIJa9D0Hlf7aS4Ra7GhRtYVDEA,128d1492cadfdb4a1719ad4d9adf28de,5,2024-02-14,"It turns out there is Oh what about dibsd? Family favorite cafe for a long time. Accidentally, I was dropping my wife off for a check-up, taking the time to stop by to eat while waiting in line at the hospital. Good job!! Vegetarian options: Various kinds of vegetarian preparations finally tried Alfredo vg Kid-friendliness: Theres a kids menu, you know",1
82673,ChIJk3H6ZNLxaS4R-RH1Ax7i0sU,c5df133bd7149c88af9692840d7c43e0,5,2024-04-10,"JH Kitchen, Cookies solution",1
302987,ChIJR6fgVTHfey4RMG6XnFtJP_s,bfc52a554a0be56264cb2d686ceb0e21,4,2024-05-11,- The atmosphere is cool at night - Cool view of the white building - The food is good - Recommended hanging out again,1
132653,ChIJ-1vR1v__aS4RpuTLYlIve44,842439648295ae3896239122cd391d3b,5,2021-05-10,Recommended for coffee lovers,1
87126,ChIJneF-WjT1aS4RymEdX_1Sg-k,b2937242b64e3fee788e75160a115627,4,2024-04-10,"The satay is not bad, it just feels deserted and poorly maintained.",1
151404,ChIJF35WOyr5aS4R7ytGNvJdQXs,10b128a0d128f225a8069691faebd10d,5,2024-04-14,"Hmm, a place to snack, eat, drink. Maybe the one who is a bit lazy is looking for a place to eat, even though every seller provides chairs and tables. There are just some traders who dont provide it. Then maybe a trash can. Its a bit difficult to find public trash cans. But overall its nice, the place isnt too hot even though its packed with visitors.",1
419722,ChIJvaFU4CBbei4RcJnLN1rXrzY,37378e6d4d46002970c046f12d1ebc3e,5,2023-08-12,"clean, fragrant, comfortable rooms, friendly staff, recommended Rooms: the room is clean, smells good, twin beds but big, wifi tends to be lost (from room number 10), TV is digital and also likes to lose signal",1
264414,ChIJwXvyBymNei4RgeViUWydePg,ad45052f92d8ec55c57814be7379c6b5,5,2023-05-14,"Go to Kopi during the day with the family, the place is comfortable, shady, not hot, the parking area is spacious, the food is top notch, the smoke is really delicious, and surprisingly when you pay its really cheap, really recommended for gatherings or just to unwind",1
75736,ChIJJ4jpm9H1aS4RJrEx_5hVD6k,0f5db571ff7ea26768838286b1d2331a,5,2024-04-10,Ok la,1
53520,ChIJZyh6yuP1aS4R5JYDSwDe34s,29b08c363ea17a6051260a1e12212c87,5,2024-04-26,"The food is really good, from fried chicken to fried duck, payment must be cash only, so prepare cash. Inside there are lots of fans but in my opinion its still hot, cooking in an open kitchen in front of the cooking process doesnt take too long. The atmosphere is quite busy with buyers.",1
387843,ChIJX36HHRr2ei4RRYjh43dZFJE,07470f1352f50d017e12575ae8edcfae,5,2024-01-12,"You can look for various types of bread that are cheap but delicious here, the best ones are the donuts, I think they are delicious",1
406586,ChIJa15OD8hXei4RZmsN5OL64pU,5ed99c6acbab83a9d54ac2c12cd1b4df,5,2024-01-12,"The cafe is really comfortable, the place is clean and cool and the atmosphere is cool. The toilet is very clean, and doesnt smell  . The food was delicious, when I went there I ordered lasagna, ice teller cake and whatever cake there was, cream cheese or salted caramel, I forgot, and it was really delicious. The variety of drinks is also delicious. Its really best if you want to do homework with friends or hang out, its better to just come here",1
446221,ChIJl7U5QohXei4RmVF4Tmm9My8,0c798ddfad1e716420aafc01c62332e9,4,2022-05-14,"Pernah membaca tentang roti yg sudah lama ada di Yogyakarta. My first visit here the time showed around 12.30 pm. I got here and I only saw only a few pan. I took the bread (roti tawar) and they offered to sliced it using machine. At home, i tasted it and a little bit surprised.. The textures similar with sari##ti, and taste sweet... I was disappointed not bought more   . It cost 15k each..",1
352055,ChIJPRVaMWbteC4R-u1Vy5uZBeU,42462eefcfe8929fd242d54d4010428a,5,2024-01-14,nyaman banget,1
353487,ChIJHaLmGXqXdy4RowYevO_GzzM,ac7346e4e68cfd8db86a44bfd317cf3e,5,2020-05-14,Este juice is great,1
87810,ChIJI2Ht3XX1aS4R0fSUffssbBA,bf587a2b0582b0d3197b7296653d26d6,5,2024-02-10,"Thank you for opening a cheesecake shop in Cempaka Putih... as a cheese cake lover, I am very enthusiastic about coming, and its true that all the menus really suit your taste buds, even your pocket. Hopefully I can expand the space because sometimes I dont get a seat",1
55608,ChIJPZbhYUjxaS4R7L4oRiyvURc,45e1b2c1ea3ad2011988ecfd323dbb81,5,2023-12-10,Good food There is a bar Beer momer One balihai,1
257769,ChIJK6XOO0x5ei4Rmd--85XnuK4,face36bcd3b2e7ad7ab3361001be0297,5,2024-04-14,"One of the most comfortable places to hang out, the atmosphere in Nilu is just addictive The place is spacious, my dear, so if you want to hang out with friends after college, its really suitable, huhu",1
317683,ChIJpfiw1Fe_eS4R7NFbdASzLyQ,bd180316b55358d3953e9176aa39a62d,5,2022-05-12,ok... really... great.,1
356809,ChIJr-_en0zd1i0RKdV30kUO37U,4549d7eb1a4d887540132705c947c5e4,5,2023-08-14,Recommended Jamaican Rum Coffee Milk Collaboration + The Tastiest Pempek in Bondowoso,1
289779,ChIJ2ydH5t_71y0RmD6AjYePThs,c8b0aba1a80003d6cff759eaaef012f0,5,2024-04-21,Overall there are no problems with this cafe,1
180203,ChIJIUvF3gDFaC4RlswU3unCfcE,be5bd2b424f1348b3a17b22aa6970b8d,5,2023-05-11,"It turns out there is also Siloka Coffee in Cicalengka, great, Cicalengka residents dont have to go far, now its in the Cicalengka area too",1
276816,ChIJIanDUg6wcC4ROL7yvWCWfMA,82566fc934f48c77237c7300ea385f2b,5,2023-08-11,"The taste is delicious and most of the shells are filled... Coincidentally, its just right to order the package which is dominated by a lot of green shells, its also in line with the price... Please try it, guys, for those in the Purwodadi area or those who are passing through the Purwodadi area, ,,",1
403152,ChIJjS0ko39Zei4RpkbR4z5tROU,85bc28f73271ac5489131933ce69d683,5,2024-05-05,"A comfortable place to hang out with family. Because the place is spacious and child friendly. There is a playground so that children dont get bored easily when their parents leave them to chat. This is more of a coffee place, because the taste of the coffee suits me. If its food, you can try it. What is certain is that the prices are pocket friendly compared to other coffee shops with many menu variants to choose from.",1
246590,ChIJc8VtwFCpei4RLnfz9F8coVk,0d66fda508961474772de0aaa17ecb02,4,2020-05-14,Not bad.. one of the Frenchies is in a small town like Banjarnegara.. its a cozy place to gather with friends or family.. the food menu is varied.. it can be an alternative place to hang out..,1
133329,ChIJ0RuiNusDai4RwfW6zK6DSUA,d2f66c8d81a7706913293f0d21984042,5,2023-05-10,Ok,1
92407,ChIJj_Nl_5v1aS4RapI2vruuY40,03550d5bdca3bb07ae99a83eafd22575,5,2022-05-10,Friendly prices. Lots of promos.. Friendly and polite service.,1
350302,ChIJf5hGvEU1eC4RzLt42wqKV7Y,4c1af70a87f6157c3629c2ddb1209a20,4,2023-07-14,nek gae cangkruk penak....,1
128312,ChIJJ-Vtpj2LQS4RjlGU0DKc93Q,2936e64bf0cb02a9235d375de3084d2c,4,2021-05-10,Comfortable and friendly,1
295166,ChIJ2alGXOb71y0RDIcdGFxaxcg,322580c04c32312094a2389013f8702d,4,2022-05-12,"Pros: comfortable location for gathering with friends, suitable for afternoon tea time, quite varied food menu (cafe menu). Cons: all locations are smoking areas so if you bring your family, especially those with small children, its better during the day when there are still few visitors.",1
24104,ChIJ9QskpxX3aS4RuOKfJ9RVIUs,c9c3cbe4016dba1caf08bda6b70527ca,5,2022-05-13,"Good, friendly, professional, steady",1
202364,ChIJUYerBdTFaC4RZorp9Q5aLa4,9ca81236012cf20fa62db486edf4b3fa,5,2023-10-15,No need to review anything Mcd wont go wrong. Food,1
338997,ChIJ1UzmxHX71y0RVtx_0rbE4bA,ee634e752c52b80040c9ef594a94bfce,5,2024-05-11,"my love tuku coffee my sweet darling, please dont ever change... together through thick and thin    its so delicious, my favorite is the neighbors milk coffee and the village donuts (ask for a snack, theyre soft ). Even if I want to hang out looking at the sea, just bring a tuku coffee bag!!! hahahaha cant stay away from tukuuuu <3",1
463284,ChIJEdnq5qJXei4RWFbyuL_0sp4,29654aa423e981554f52349b6b6b3e84,5,2024-05-07,"Very complete, the rooms are cute and comfortable, there is a cafe, there is a massage service. The employees are fun and friendly. Top in essence",1
215979,ChIJjX0zcZp3aS4RvQpdr4-Usgg,972de7c5233d6098b06ffb446c6342c3,5,2022-05-15,"The place is comfortable for hanging out, Mknanny is also recommended",1
130349,ChIJ-9_kQrz9aS4R9O5oTeW9q18,8ddce589bbf80679f893b961834fc21c,5,2024-03-10,"First time here and ordered the fried noodles, it turned out to be delicious, salty, sweet and spicy. For a medium portion, its not much, not a little, but because I was still hungry, I ordered more fried rice and it turned out it was delicious too. The price is a little more expensive than Mie Abang, but according to the noodle content and the place is clean and comfortable so its not a problem.",1
347657,ChIJPy4ZWILm2S0RVxDxm3B5tZc,55b505bfad67c9eb30bbf4a491908552,4,2021-05-14,Yummy,1
405740,ChIJ3ZLgHPdXei4R4fXS9x2qICU,93ada1f3553b9456a439ed18ccb383c7,4,2023-05-12,"Nice place, just takes a long time to serve",1
339943,ChIJVz1xMjHR1y0RQwQl7h3oYZs,d3343cc6f5a4a1386ed7d92d44bec783,5,2024-03-14,Good,1
294558,ChIJO9mRzE-Bdy4R6xLWeH5tni0,b464315ce02dd60cf221248441f86794,5,2023-05-12,Favorite drink that tastes delicious at an affordable price,1
375495,ChIJ5cLud8Rb0S0Rhc0NAlo9Vtg,5c67769c4f58b16a829e68a3ef9ed404,5,2023-05-14,"the place is nice to relax, everyone recommends the food, the prices are pocket friendly, thats the main recommendation",1
451005,ChIJQzUZjrz7ei4RunUb0i8evTY,039683f19626456ac5b6a8cee64c1373,5,2023-05-14,great... fresh...,1
266517,ChIJi1sVgrhvei4RxMAT48jrBEQ,ebf14d8ed71db32258dbce49cd30a8f1,5,2022-05-14,Thank you for visiting all friends and relatives,1
180188,ChIJ3WxPjl45by4R2aM2UMj0s2g,6021a3a15c83d1f8b4ef27074fe3f952,4,2020-05-11,Yemeni is delicious,1
120563,ChIJq7GEWc__aS4RpnGc73Sp-q0,a0127d841b9486041f03ab6a4103cd96,5,2020-05-10,"Since this place opened near my home, I have always been satisfied, from when there was ramen to now there is no ramen, the food is always delicious, the owner is also friendly in serving him",1
413923,ChIJ48zKLlVRei4RnAk33bRYjhc,dd48544788ed7fd43f038188663bfa9d,5,2023-05-12,Coffee and roastery located on the outskirts of town. In Prambanan. Been here several times because it is recommended. Starting from the affordable price - just imagine a double shot without the additional price. Open since morning and the menu is ready. The rice bowl is also delicious. The staff is friendly. Maybe whats a little annoying is the music from next door which often has a different vibe. But overall this place is recommended Parking: Wide,1
137702,ChIJPyod6u_5aS4RvKrADgq8egA,3fd6f710f5a33888191264d14efb559c,5,2022-05-10,"The drinks are all delicious, cheap too but still use quality ingredients, the drink mix is really delicious",1
384951,ChIJTysj-8pfei4RRpUgn6OfWvM,81788d5363eed41006e34ef730e2d534,5,2023-08-12,"Cool, cool place, suitable for refreshing, relaxing, delicious food, tastes like Bakmi Jawa Godog and fried vermicelli endesssss",1
409680,ChIJp15EhSmsey4ROK3r3Ep0KJ0,debfd45d01dd18c283556c3f0ce42aaf,5,2023-05-12,Kliwon,1
392350,ChIJKyz6-UGzey4RS0hYdoMgWyg,2582f353a5d1025e5e34d0b1ab73fd41,5,2021-05-12,Strategic location and beautiful atmosphere,1
264701,ChIJmTADwhUldy4RHFYLHMSAqZU,fd0e8d69f269de7f4965ceeaf0ff3ba1,4,2022-05-14,"The place is good, close to the Rembang City Square, and also on the side of the road, the snacks and drink variants are also okay. The lack of mosquitoes is annoying :v",1
331959,ChIJ-36XZ2a_eS4R3UEqKY49X9c,1007ca352e9709c425101b14b24d87cb,5,2023-11-14,"Its a really nice place for drinking coffee with friends, especially doing homework. The food is cheap and delicious",1
420125,ChIJRada-Gnlei4R9PcSt-AmxCc,9876dd305ea999ff0accbfc6413d169b,4,2023-12-12,"The coffee tastes the same as coffee cafes in general, there is a special place for non-smokers, its nice",1
46451,ChIJXXHPaFrzaS4RoeCVvUdB3_E,9d4907e4d0a1e0cdd5132b5f40cc6439,5,2023-11-13,Pokonya rekomen banget buat tempat santai ngobrol bareng kawan,1
39505,ChIJgekvmA73aS4RCyGSr36jwAU,41814ae8c86597ff7f5771a199856787,5,2022-05-13,"The place is comfortable, really suitable for sitting around with friends. Whats certain is that the prices are affordable and there are lots of menu choices. Highly recommend trying here!",1
4912,ChIJvVPyAonxaS4RO_IwkdRSeaY,a8e39551443ac8733269b179b28d6708,5,2024-04-29,Very good place,1
6746,ChIJCR9vUd7xaS4R0vmnG-6QXqY,52785aabc3abc9ae5de9f71d71290549,5,2023-12-13,Lots of FUN,1
335900,ChIJZdkREwAp1i0R_DtIEHqvc7Y,92980a0681f7ed0ba34122a29798de54,5,2024-04-14,"New Bingsu in the middle of Malang city, the place is clean, neat, comfortable, Instagramable for taking photos. All the Bingsu variants are delicious  , the food is also delicious. Bring your kids here and youre guaranteed to love it, the portions will fill you up. The service is good and fast. Continue to be successful, Gugu Bingsu Kid-friendliness: Children definitely love ice",1
272075,ChIJh-CQmP6HcC4RCeeaUIFMk4o,fef3ce78d6938e785151341b2aa847f2,5,2023-11-14,Caramel Machiato + oatmilk + whipped cream is great      the palm sugar coffee is also delicious... just bought the pocket coffee to take home...,1
262349,ChIJs5TglQ6Hei4REp4wlfTFbzM,e455f550310afe37655c6c4d90643628,5,2023-05-14,"Recommended coffee place, the environment is still beautiful so its really comfortable",1
24133,ChIJeWhOGWLzaS4RKkY19d9k3B0,1c001d87d46b38585b5558d83fbb5b1d,5,2023-11-13,Just tried it... I was surprised that the portion was too big for the UK...,1
152947,ChIJR_cA04T5aS4RpToL7EO4TH0,aeb7532e03ee7291391a71655baee1dc,4,2023-12-14,Not bad,1
81901,ChIJtfg8l6v3aS4R5cNq44zwEXk,0a8b1123dc548105a9c69921fd7e5620,5,2024-01-10,"Came here for Christmas, I think the food was delicious. We got: The chicken soup tastes good, but the sauce is not hot (maybe because when I took it first, I just heated it up) Fried noodles are delicious too In my opinion, there are parts of the fish that are delicious, there are also parts that dont taste like that, but overall the fish is delicious (I dont really like fish) The black pepper beef is delicious, not fishy The ice shawl mayang is fresh and creamy The place is quiet, dont know what because its already late (7-10 oclock) The service is friendly, the waiters are very pro, ask for help making photos and videos",1
178159,ChIJ5xK0Y7heby4RbKoR3JZ5gW4,5988fe6dc99c51942284f9ceb3ea5e76,5,2021-05-11,Its recommended,1
3991,ChIJx1v_Rn30aS4RNI0JeL4tFkk,595c3383aa79a65dad3a7881db82ba77,5,2023-12-13,"The food is really delicious, my favorite thing here is the honey grilled chicken, its really great, the atmosphere for hanging out with friends, family or girlfriends is also very comfortable, the waiters are really friendly, just dont give up on going here",1
391962,ChIJK3wfEXJXei4RZw5i0B4BRbE,0735a87378959e1d8416b1428ea8a792,5,2024-04-12,"Definitely Recommend, Khao soi nya oke punya!",1
253491,ChIJsR3LXxUkdy4RLkE8kiHVY6w,83b83a0c0b3843867b848c35484e2966,5,2023-05-14,Comfortable place to hang out for Suzuki car sales info 082110388028,1
417590,ChIJSZSU3GVXei4R8IJpWywQIwA,c5b090d170c5f360db368418eea28ab4,4,2022-05-12,Nice place and cozy..,1
242570,ChIJGaUNTy5YZS4RtADN-TqTwJI,152441b65ad0c741c509f87837a98a66,4,2024-05-11,"Cheap place to hang out/snack during high school. After spending a long time here again, its cheap and cheerful",1
433611,ChIJ9Ty6f3lXei4RCS8WUMg3L2E,bf42eb2f60055e209ed403d528a09584,5,2023-05-12,The place is comfortable Delicious and accompanied by live music with old songs,1
61952,ChIJ0x0kErL1aS4RPhkUMoMI6HA,424ae51fd98d150c6f1b0b5f098545d6,4,2024-01-10,"The service is quite good, the atmosphere is nice, calm",1
19362,ChIJITg5qeT3aS4RjzIiPelfcTQ,0145027a6a7830cf555ce4c83afc8bc6,5,2024-05-08,1 portion of food is a lot so you can make 2,1
274601,ChIJ9bCv42xfcC4RpUHpkZH58fc,6b767389883637c24af298208be08e8b,5,2021-05-14,"The service is very good. Its delicious, fresh, jossss",1
392863,ChIJ58ihnNz_ei4RPh0gHPhBUrc,562697cf56f1f2bedcb9b0afd32dd7d7,5,2021-05-12,The place is comfortable,1
196378,ChIJDcm7e5FTaC4RUzHIV_9kfAc,0baedfe816d6c7183982094915e4b15b,5,2022-05-14,"The place is nice, the food is also delicious. The price is worth it. The atmosphere is really comfortable",1
370760,ChIJAwfnutAo1y0RT--HwbKGHv0,b9bb118a8d82f690b169f750a1decec9,5,2023-05-14,"Good place, really cozy for hanging out, really good for waiting for futsal friends",1
132648,ChIJ-1vR1v__aS4RpuTLYlIve44,92f7d1509aa09807268221b3d3232705,5,2021-05-10,steady soul,1
364163,ChIJ2TrNedz71y0RArGnwAjeMh4,171502f687350e7683ac22a8cf68607c,5,2023-05-14,"The cafe and restaurant is located inside RSIA Ferina, came here because my wife underwent IVF for the second time, the taste of the food was delicious, in our opinion, we really liked the rawon and nasi empal and mixed rice, the staff were friendly and helpful.",1
254305,ChIJt-MPDABLZS4RCcJY4Ebj-W4,bc1e09549c1f65d5740d56fe64979161,5,2022-05-14,The place and coffee are top,1
334614,ChIJne5UT3Ip1i0RLVgaSlXWwvQ,5dd5c8e3a406e05471a05ba143883f70,5,2020-05-14,"A comfortable hangout place, friendly prices.. the coffee is great..",1
25946,ChIJxb7VWd7zaS4RUeg6rac6ZIY,999672eace838d241dcc84a91c59023f,5,2022-05-13,"Come here to eat holycow in the parking lot, public parking lot and there are various choices of food and drinks. Can eat in the parking lot.",1
334660,ChIJgY6ZbR8p1i0R4tmALyl7Daw,477b9cb431e03dd405375ab65c11d07f,5,2020-05-14,The place is nice and nice to hang out,1
158400,ChIJTXjLl8_6aS4RibfbpvTptUo,e83bbb0fcad65ee9a98b94771c6e9cf5,5,2023-05-14,Excellent,1
399963,ChIJp0uKh773ei4RGsC6hXX7XQY,7ec4180c58579ed461d9f91b780ea468,5,2023-12-12,"One of the family dining places with a Javanese feel. The location is in the middle of the village. Pros: -The atmosphere is quite calm and not too busy. -Thick Javanese building feel. -The food menu is quite extensive and varied, from kere satay to grilled rice. -The price is affordable. Prices for food start from just IDR 10,000. -The waiters and staff are quite friendly -Parking is quite spacious. -There are indoor and outdoor dining areas Cons -The back area is a bit dark at night.",1
244555,ChIJBUHJMsENcC4RP6cvmaDOxHA,fa92f1c1fda02bb7eb35465fa1bcb6ff,5,2020-05-14,Good place,1
231748,ChIJt5XUJ6OJcC4ReCuGKo4ka8A,117b4552d36b3fd49e56c808cf99f799,5,2023-05-14,"The chicken is okay, the service is friendly, the prices are pocket friendly",1
427601,ChIJiSAWeWNTei4RPOnuKBlMPKE,5b9cb109a35d353c9acb3c1df578a31f,5,2023-08-12,"The fried chicken, great",1
419880,ChIJoV33RPa1ey4RRuI3Vj2ecs8,2af39837b928f9767dbe2ec04249974d,5,2022-05-12,"Tempat nongkrong bersama keluarga ataupun teman-teman. Suasana perkampungan tepi daerah persawahan. Terdapat tempat duduk di luar ruangan, cocok pas sore hari dan tidak hujan. Menu makanan, camilan dan minuman yang beraneka ragam dengan rasa yang enak serta harga yang murah meriah. Rekomendasi camilan tape goreng, rasanya mantap sekali.",1
274183,ChIJz40gDIRvei4RusSaarReNls,7746180cb09e0f244107ffe362ea7276,5,2021-05-14,Because the location is strategic and the service is satisfying,1
2385,ChIJuwaKPNrxaS4RXGWyQ4RPLEw,7e5b8de47737f02609aa565e04d0beda,5,2024-04-22,"Hospitality is very good, especially from Mas Darma As for the exceptional taste, there is no room for criticism Thanks",1
199118,ChIJH6YpvO7LaC4RtgS8LigGEBs,fe737708a07685b0438e23dfc712cc23,4,2022-05-14,Ok,1
23527,ChIJq2yXOST3aS4Rj17D68tm10k,c53f6f4475bcea9bbe27b8603507806b,5,2023-09-13,Crowded,1
78495,ChIJLa1ApkP1aS4RTOg-l36ucM4,de1a65848e163473997d40654b711036,5,2023-10-10,Good luck for Nongki,1
389940,ChIJSTvU0Heuey4Rt1_tlQo9qM4,1af10a6aecea23528d3d7bf22ea1e044,5,2023-05-12,Indomaret is the closest to Gunungkidul beach if you go via Imogiri-Panggang,1
55391,ChIJS9ijUjT1aS4R1Dv9_N3yke8,49de89cb9fdaee6ed211d65156ec0028,5,2024-03-10,"Perfect place for having a good time and delicious food. Many to choose from the menu and should try their specialty, pancake, I ordered one with chocolate ice cream on top... Awesome",1
151737,ChIJ7R7oTxX5aS4R0rLxSJ_MAG0,cd7c79bb625e1dfd575829604308d2f8,5,2024-04-16,"the place is comfortable, the food is also delicious,",1
138299,ChIJm6QNZcKPQS4ReeERG1ss7lk,1f89f68692898c2c5e2d109bd06e3bc4,5,2023-05-10,"The place is really clean, the ice is really fresh",1
59756,ChIJiW3075PzaS4RkAHWSA8FXd0,41567caff22bc5a70174a3b6a1e52a09,4,2024-02-10,Not bad for relaxing for a moment,1
378711,ChIJY9aKcpj71y0RW3AIcWXdRAs,8b2568e7b76853f48f584f2ad6bf7c54,5,2022-05-14,"Its really good for doing assignments, etc",1
122423,ChIJ2Z6bwFH4aS4R4SC3Lnzxr14,49f40acc59e3fc2b4120e7ee633584e7,5,2022-05-10,Ok,1
320527,ChIJ795T7w771y0RSO_Lh8IB454,1cdb958b467e87bd6adaaa2320c6b99c,5,2024-01-12,Well done boy,1
248527,ChIJiSWgjm11cC4Rzunw1KJacv0,92e7fd6a262aeaab9df32c3d52dd3636,5,2020-05-14,"Offers local coffee with extraordinary taste...... Also provides coffee equipment. Such as kettle, digital scale, v60, Vietnam drip etc.",1
274840,ChIJxX7CYo1rei4RpZnGBfNnWNo,46731986a54e67324270b4f9b8451ce4,5,2022-05-14,All menus are delicious,1
95413,ChIJj84AF5z3aS4RrPB_2Yaa_K4,edc0361bfda6a1f211963472f16ee95f,5,2022-05-10,"Tasyi poisoned, its fast... the closest one is in Neo Soho. Its located in the food hall, LM... and the croffle is really delicious... next time I want to buy it again and try the drink",1
252662,ChIJlZrqLAwWei4R4gqBDx6w3T0,04cfdced6052581d1cbb9c4c4ea6732a,5,2024-03-14,Nyante bareng tmn2 ...cocok bgt.,1
361490,ChIJWVzR3tHb1y0ROtOSr77wYFM,8d6c4436f104a87c445918522e1cddf0,5,2023-05-14,The green coffee is great,1
410642,ChIJvwnlXR9fei4RvTZRg2PNbp8,49b102476ab3634e6ba8ea60c1522ac9,5,2024-03-12,"This is my regular place to buy coffee. The most favorite is palm latte coffee and Canel coffee which has a unique taste that has cinnamon in it. Apart from that, the food is also delicious, Ive tried the snacks since they taste delicious and the plating is also interesting. The place is also comfortable, both indoor and outdoor",1
276342,ChIJ00vO3DHLei4RTEumPmu6pEM,52a71ad2e3d1160e121a42b1d5e4e93e,5,2023-08-14,"Attractive, comfortable, delicious",1
381719,ChIJi4awQTP71y0RUsO1UBon_Uw,0cef3b59fa0bcd22876250217118898e,5,2022-05-14,"Great Kopine Josss, strategic location. Affordable prices,",1
467460,ChIJ2QzGoPBXei4R2Twpo_I7Clc,19db7528149d3cfca7944c91eed07813,5,2022-05-14,The coffee is delicious,1
235056,ChIJDSWvPiQZei4RrIzFY55kIv0,8544053576241004527b3d7f51d3b218,5,2023-05-14,"Come in, Mr. Eco",1
141327,ChIJVQjP5UfvaS4R9d_20KBTcUU,579b66f9e9312793853250f512da9990,5,2024-04-14,Ok,1
293666,ChIJS0BiC6z51y0RDOT9o3gmZ5g,2ff9ecddd6baeb01a771d747d8de3503,5,2023-11-12,"The food is delicious, the service is friendly",1
321109,ChIJy3VEZGX91y0Rd4fkvAqhVsU,04dc93b5fe4edc0f16386e2f4fa0a834,5,2023-08-12,"Unique coffee shop, lots of coffee variants and all of them are delicious. The menu varies from coffee to non-coffee. the place is also cool to hang out and the shop owner is also nice to chat with",1
107256,ChIJJfFjjHP4aS4RkZAigjGWSeo,d0b06e8eee31507e43efabac13f4d3e5,5,2023-05-10,Nice place for hangout,1
334241,ChIJoywU7NkNeC4RKKWmRqSsm3U,368608172c09c14ee5f07bd3c01024d8,5,2024-03-14,"The place is clean, the service is also friendly and fast. This drink is really suitable to accompany our days. Very affordable prices that wont break the bank",1
45457,ChIJw_HFLQvzaS4RJ2pnRJVg_K4,85c551599a80a9b2e90fff68fd1e3333,4,2023-05-13,"Langganan th 2000, mau beli lagi ternyata tutup. Lihat di google maps ternyata masih buka.",1
378976,ChIJW1cHw6_71y0RIlPow3XI0fg,38c4fd9b01bd6da0aefc2853a0952c4a,5,2022-05-14,Pretty busy,1
28288,ChIJl5q3l4b7aS4Riy-gyvwW9UU,de0476a46cbbde51e8b585057940d91a,5,2023-05-13,"Great place to chill back and have a couple of beers, they have a nice selection of local beers. The owner and staff are super friendly. Definitely recommend to those in the old town area to come visit.",1
228631,ChIJ3bcnGiUTZS4RiPvC4bkXYV8,dcbfb9c6665088b1cfde98e42881e749,5,2024-02-14,Nice place to hangout with flocks,1
50247,ChIJB7XwNYXzaS4RuHL32FFq5xo,4e555d9e583b2f1103986176995c8317,5,2024-03-10,"I like the ambience, the food is also quite delicious. Its a bit pricey but its worth it",1
