,place_id,review_id_hash,rating,published_at_date,english_review,sentiment
393916,ChIJkzQo6vRZei4Rhf0Cu5Bvexs,90c169623223fc7d115e1181892cee8a,5,2023-07-12,"The food and drinks are really delicious, the place is clean, the atmosphere is comfortable. Im sure youll feel at home here. Of course the prices are also affordable",1
325023,ChIJc038-7oNeC4RU561lCy0ulE,56fd356ca2ff3777ed97495bfe413b7c,4,2020-05-12,"Drink prices are cheap, the taste is decent. If you drink here, the bonus is free wifi from the KFC wifi signal across the road",1
157360,ChIJ9_gzVSPlaS4R06chlgmkBXA,136ba10241278bf3635b669248e625e3,5,2020-05-14,The coffee is delicious... Especially enjoying it with friends... The prices are also friendly... Highly recommended,1
453311,ChIJvyo588f3ei4Ru63amcc7YXY,ec833907528db2f44de713785c847c9d,4,2021-05-14,The yalibu is really fresh. It has a minty taste,1
62989,ChIJ-0YkMM71aS4R2mTM9qqv1d8,23c3c6897445bbc94d611d0265919914,5,2024-05-03,The chocolate is really amazing. Super delicious and the quality is way above common Indonesian chocolate shop,1
15624,ChIJQ2lsugj3aS4R0Gc48AxvwGU,7c2f421b28978caa26284ab3bf6efe41,5,2022-05-13,"The best soda drink in Binus Syahdan    Thanks to the friendly owner, Mas Henri Andrew Dharmawan. See you again!",1
377202,ChIJtZJph-bDeS4RXNoQeCv1_Es,e6c4ce77e1adf1c9cffd21eacdca35fa,5,2023-05-14,"Great, the atmosphere of the stall near the rice fields",1
259805,ChIJ0QJyvfiPei4RUqBWsuCZJgE,f4adab8a3aedfff62f8d03db1079dc91,5,2024-04-14,"Podjok Kopi has a strategic location, stop by when youre going home, its delicious because its 24 hours with a modern angkringan menu...",1
70101,ChIJpeLp6lmTaS4RPUpt03rvcvA,4584c796dd602e02abd712e21260b36f,5,2023-05-10,The T4 is comfortable for hanging out... The coffee is TOP.. The service is the best,1
430690,ChIJ53UqSfRZei4RPW_I4XSJYow,bef1a4ee1b27d755bc28b1a68e487c78,5,2024-03-12,"Its really fun... in the afternoon I want to snack when I see this... The cheese prawns are okay... even though I want more prawns...   Yes, at a price of 10K, its worth it... The crispy wontons are delicious, still delicious eaten just like that or with dipping sauce.. The spicy wontons are also okay... the sauce is authentic to their own recipe, not the typical chili oil like usual...",1
30385,ChIJLfCGAQnzaS4RtVwmiz4J1J4,2f21cf3c7df16838abb2d33ee53cb3e4,4,2023-05-13,Good,1
426465,ChIJaWHSmRhYei4Rh8m8fyVGisE,8a6fd45232b292443b06c4a58c17b1f2,5,2020-05-12,Angkringan,1
252446,ChIJnwkVLoB5ei4RBAOd5J6WFhg,43f523e6d07a0214773d96be21271968,5,2024-04-30,The atmosphere is good for hanging out with friends and relatives,1
277392,ChIJ19jFuJNFei4Rv5gCDt19cqA,25777fcbe830e3e978999e90250d1707,5,2024-05-07,Delicious and cheap,1
340678,ChIJm0gSeiDd1i0RVf-IXvOIC-s,0faea60653039ee2dce6cc5f15ae8159,5,2023-05-14,Es teller,1
398719,ChIJBX0nkRhYei4RgFu1v3aGxbA,36b0b93e2a65e07a30d1d6bd179379a2,4,2024-02-12,"Craving to go to Thai Resto because Im pregnant, I want Thai cassava and Tom Yam, thank God everyone has it",1
136253,ChIJSX4o0vUdQi4RuWS2Ms2dnBY,4dc33db09c115cfe744bbabc75cae4be,5,2021-05-10,"The place is cool, the music is good and the menu is economical for the pocket The taste is also delicious",1
46222,ChIJJRODIY_xaS4RmEQ4r3zluB8,76b564de38d381e1d0e0ad9599b994bf,4,2022-05-13,"Tempatnya cukup enak, rasa kopi Gayo kurang strong, kopi susu gula aren nya rasa kopinya juga kurang strong",1
392393,ChIJXRZOjK9Xei4RwPNdG6-lCN0,fa57b1ad35ec20e9b794fecd172517dc,5,2024-01-12,Healthy menu...,1
124253,ChIJkeS_mssHQi4RwqOYuZbvSdE,504b665ba13bc1a6836690d66941a993,5,2022-05-10,Mantabb,1
278563,ChIJo0WZvhu9by4Rrf-2kgRph_k,8dda0c5960f89f94f34749df962feb46,5,2021-05-11,Comfortable,1
372830,ChIJt7CJ3xhb0S0RfzVwQ7-hkl4,abe9dbef94f19ba0c8a3d2f14a9141f3,5,2023-08-14,"The place is very comfortable, lots of spots for photos... Highly recommended for a place to hang out with friends or family",1
29760,ChIJgc0-Ae73aS4Rx6LJL9UpI4w,3d780e19ece83f281af38b71dc9630de,5,2022-05-13,This is the best. I really like it. It feels really right,1
232686,ChIJTUTtpT9fZS4Rig_ZpvCRVUA,2bfef888765db77e1743a6226cc6b06a,4,2024-03-14,"The place is comfortable, the view is ok. The price of food is quite expensive for the city of Purwokerto.",1
383162,ChIJgY6DZTNYei4Rsbd2vr2iw1A,3913cc7db12b8bbfbc8e3ec48e422470,4,2024-03-12,"The taste of food and drinks is consistent because the kitchen is disciplined, but service needs to be improved",1
430168,ChIJM9w06Rpfei4Rc683ks-0wdo,ed5181d1bc7f5f7384846dd5449c181d,5,2020-05-12,Sip jos,1
407144,ChIJSf8YrtVXei4RwJqrSghq-6w,d427c90da334468e0ea67d5a30af4227,5,2023-05-12,"Its clean, the service is better than before, where the bros were happy to serve custom menus and also memorized my order xD because in the past Ive had problems with the ladies because of custom compositions. The prayer room is also clean and tidy too. If you want something a bit quiet, you can go upstairs if its still quiet. Plugs are also not stingy. The chair is good for doing assignments and the table is also square. Standard price. Thats all for now. Just feel at home. I have deleted the previous review. Hopefully the Homwok Paris baristas can maintain their good service. If possible, other Homwok branches will provide prayer rooms. Thank You.",1
304048,ChIJndDcvDKSeS4RTSBz5bI3mNI,444681d008cf507a099440fbe49984ed,5,2023-07-12,The main recommendation is... fast response for grab services and orders via WA,1
186043,ChIJG8NwZLzhaC4R-xkoxwAqxYU,9dbf079d297b0034967a95b71165c6ba,5,2024-02-14,"Nice comfortable place, not difficult to find",1
328501,ChIJcTVDnt-_eS4R_Sgr2YhfvnM,b8681bd11a74d2d0d9cb6074b2cb0195,5,2024-04-14,"Parking, staff, everything is okay",1
95183,ChIJWfiAL5XtaS4RgSv_ejoJVAE,df4342bc84e2033c4ff063052cddd393,5,2023-08-10,"The coffee is delicious, the service is very friendly There are sufficient parking pockets available. The place is also comfortable, the wifi is fast. Dont hesitate if you want to come here. Good luck with your coffee",1
149312,ChIJl2fW0JzxaS4RoIKGAh_EMnI,4abfaea658548784160f3860262b9519,5,2024-05-07,Its a cool place to relax and theres also a wedding location too,1
34858,ChIJn3un3QPvaS4R1_h9wNyNFEI,a7653166ab4d786443ddec9907cfd438,5,2023-05-13,Mqntul,1
203729,ChIJaQqvY8ONaS4Rq4eg1nD4N1c,e31a5c5046b1819c87d8dde1ba14db58,5,2024-05-01,"Wow, I found a nice, cool place to drink, the food is delicious, suitable for having a nice coffee while chatting and discussing this and that with friends, partners, business partners etc. The point is that the place is nice and comfortable and the coffee tastes okay in my opinion.",1
170611,ChIJT17mg7w8aS4RMzWRRKfh7T4,2e17bc7b1b878bc4a978b367a8fe6dd9,5,2024-01-11,The foot soup is quite delicious and not very expensive,1
4682,ChIJ_7oeVrvzaS4R9zzYwSBr4IM,e7fedae1b7ff705e65917c13f93df12f,5,2024-03-13,Relaxing coffee place,1
275783,ChIJ9zW3PAqBcC4RnEC6GvgZaxY,f6df1902210db968ebf8824f64009c97,5,2022-05-14,"This is great, guys, the place is also comfortable and there is live music too. Exciting",1
95182,ChIJWfiAL5XtaS4RgSv_ejoJVAE,9fce8ac2eed096febfeaa08ebf00b7e6,5,2023-08-10,"The food and drinks are delicious, the prices are also very friendly, really recommended",1
436333,ChIJK12i1y5Zei4Ru7EyYNRHXiU,e8773c30db8ebb5e86ddaa42b70e7512,5,2022-05-12,"beautiful location, great food",1
53757,ChIJ0XGgH4H2aS4R5IFPwI3P3XU,6a87b95fe1db5d13fb66f57d8a3a2dd5,5,2023-09-10,Great,1
51568,ChIJ_3gq4yDzaS4RGGEcoapOUyk,0f44aadfced26e13a825b33de7932f54,5,2024-01-10,The menu is always complete and delicious,1
95496,ChIJ45k0n0j3aS4R-Bd27dnz3hI,1caa5fe8e9a65b96c965e7b1fd6b356e,4,2024-03-10,"The place is nice in the old style, there is indoor and outdoor, the parking lot is quite spacious, the bathroom is quite clean Prayer room available, free wifi The only downside is that there are quite a lot of mosquitoes indoors",1
329025,ChIJTVhWWEP91y0ROFRsvrLrbt0,3cb0d13194039d53e03d412ab4613e1f,5,2024-01-14,Great steak,1
85461,ChIJKVEiMLsfai4RwlT6GZuOLwc,97947e58bba43274df0450e770fd1d0c,5,2024-05-03,"The best cafe, recommended food and drinks",1
343225,ChIJxynSXl2-eS4Rkem7YJuwve8,1afe5f8b0dcb1561a7c1db24ba83e27e,5,2020-05-14,absorbed,1
334479,ChIJ--5roh-_eS4REZMRXIc3Tcw,d49a2396c5bb1aa28ca27ce2c7296e28,5,2023-11-14,"The food is delicious, delicious, large portions",1
342891,ChIJH-HK7Xmjdy4R2jARWeOzr8E,3876f7b2025c1acbe4b222add42daa74,4,2023-05-14,the price does not match the taste,1
24078,ChIJ9QskpxX3aS4RuOKfJ9RVIUs,92e2d8ecc03227d20728c92e81c40d78,4,2023-05-13,nice place... the coffee is good but the toilet is really dirty. Please repair the toilet so it is clean,1
360848,ChIJ6aDD0oANeC4R6F0XCqFvTvQ,9749704ed3d756267d4ff36719044734,5,2020-05-14,Good,1
465350,ChIJgfdT4slXei4RpUv2fxt2Jms,88844ffcd2d8cd210676dea7c0a0b5e9,5,2023-05-14,"As for the concept, I really like it, enjoying the atmosphere of the Prawirotaman streets, its really cool After all, the Americano coffee is good",1
181867,ChIJ831mUqDFbi4R3Ii6e9jJO_4,96b3e749a3984df09cfcb688a01da81d,5,2022-05-11,Snack stall,1
76425,ChIJBWiubkn2aS4RUclxtrWmO3w,59713ae573509e12f9ee49f8fc213932,5,2024-05-03,The service is good + fast. the place is also spacious & comfortable,1
269349,ChIJ1RHScxCHcC4RkenT90hESok,31b869fc13e02e81911c91fbd866bd75,5,2024-04-30,Ok Ok Ok Food : 5/5,1
58978,ChIJu4aBvyX1aS4Rv8bIOQoTGbY,f5e39d175235ffd3285dcdfea61a5a26,5,2023-09-10,"Confy place, the staff are also friendly     the food is also delicious!!   luv it!",1
346610,ChIJRduJBfX81y0RYs0chAEz7yg,c8934e0b4d5299aef33bf6e8b9906fff,5,2020-05-14,Greatpppp,1
459901,ChIJtzO8BIZXei4RFGLuAO26288,4775ecbb834190708523739d5e286e30,4,2024-05-12,"Sehr gutes Essen,nur leider funktioniert das Bestellen mit dem QR Code nicht wirklich",1
36237,ChIJFXPYemb3aS4Rj3l137_q50k,43a83560d1fdc834746e53b93167b71c,5,2023-05-13,"Good atmosphere! Good food! Prices are very friendly. Mba e is really kind, very friendly so its comfortable.",1
255061,ChIJw4kiKnN4ei4RWWr_vwjC1cM,1819ac966be97456a92fa4e47fd7432b,5,2021-05-14,"Comfortable, friendly",1
175953,ChIJX_3eXIWFZS4Rd1b7XpfUgUQ,1dcdb58c2781b028f98b8299400b6d24,5,2023-05-11,Coffee lovers must try it,1
170825,ChIJxwStWLbzaC4RKUqvgP7TTsk,fcca9acfbb3a2e02a8c5d83a0f9240ed,5,2022-05-11,"Rose Garden is a place to hang out while eating, the atmosphere is homey, it feels like a holiday in Bali.",1
8659,ChIJvUmPtnTzaS4RuEgxkiZhimg,d1fdc93fe4ed59a9e20db5efe4a889ba,5,2024-02-13,"Coming here, its a shame that the indoor area is full so you have to go outdoors. But luckily there was a big fan so it wasnt too hot. The food is affordable but the taste is okay. I really like the mocktail. Most of the indoor ones are WC or private, not suitable for large meals with lots of people, because I saw several people who came and finally decided not to eat here. If you want to come here, make a reservation first.",1
460347,ChIJk-q9jRRXei4RynFu1T6P-c4,40c95943141ec28974e1918190d47d57,5,2024-02-14,Meat platter is awesome and stupidly good value. Service is very efficient and pleasant too. Been back twice in two days. Will come back next time I am in town,1
206556,ChIJkZBZeqbEaC4Rqgptcp_Sdgk,1d17c4220b76af1ac30c04dde2dcfe22,5,2024-04-15,"If you miss seafood, maybe this is the place to buy one portion, good for 2-3 people, but the portion of rice is a bit small, the measurement is still the size of the portion of rice sold at chicken hehe But the seafood is okay, the taste is okay, the portions are quite large, the price is right",1
156254,ChIJRYrZhy_7aS4R-kxb_fv4U-w,bd6d3f90192ce767bcf60c13af5f9c00,5,2024-05-12,"The steak is delicious, the service is ok",1
63300,ChIJ08eseDf3aS4R0tEQxPlMAaE,325187313befbbac0b3e1fb3959fde25,5,2024-03-10,"the food is delicious, the spices are not stingy, the service is friendly, the brothers have fun, the atmosphere is not comfortable, the AC is not cold enough, and there are lots of mosquitoes Kid-friendliness: suitable for young people, and here it is a regular place for young people to hang out",1
365323,ChIJdTQr8RS_eS4R2PdY98x9UIk,bcf643b7276df9d7c978396a6b87e9de,5,2023-05-14,"It tastes good, right on the tongue, its not bad Kid-friendliness: The sweetness is just right, doesnt make you cough",1
167814,ChIJ1UudvRixaC4RJmMvF7g5swY,d46425944d702e38f6b5d6f0f4969d8b,5,2024-04-11,"Its delicious to have coffee in it.. lets get started, gang",1
120368,ChIJSwDrx3P5aS4Rnj8C8wO6SAs,a5317abf4e1ff3696269ef254a29a782,5,2022-05-10,Fun to hang out,1
3732,ChIJ_a4sfr7zaS4Rf_y7pT7kZBU,a86b5c9433d17e5f4c2bd3b3d03d1fa1,5,2024-02-13,The menu is extensive and fun to relax on,1
331349,ChIJbTK6KbK9dy4RtKE-MeUeTsc,598fe992a7c1e8d2c881c9779b923b62,5,2024-02-14,There really isnt anything wrong with the drink... you can also substitute oatmilk for the milk.,1
380941,ChIJw8CE09771y0R_5pE-8rqkEA,afa0c016d0f60f86ec62fa7e7b741022,5,2023-08-14,"Good restaurant too, I complained about the food, it was immediately replaced and delivered to my house, thank you for the service",1
407709,ChIJH5yTxCVZei4RYM6Kvq1fEqw,c3a8067468f42a923dbd85ea70e05a62,5,2023-09-12,"Honestly, I really like the strawberry coffee, its really my favorite drink when I come here, but lately its a shame that the taste is often inconsistent huhuhu",1
231827,ChIJk-xWP5JtZS4RWETBITfrRzI,868ee203b59d00452dc1b072ca7d75d8,5,2020-05-14,Missing You is recommended!,1
456177,ChIJ6yJ-AVNZei4Rr4vYemRnVcI,85db168fe12c764e47340a5c5f42d525,5,2022-05-14,Make a night out while enjoying food... Shahdhu,1
270533,ChIJCa_FfDLrei4RXWvLg9zRtUc,aec3cf5a15e5cdae0b19fd32ebb5ba4f,5,2023-05-14,The service is friendly....,1
313999,ChIJF_ETljKBeC4RVQU-lDcNE24,a43f46316c5d27ab20e3a39325c7b701,5,2023-05-12,"Delicious soft bread, price 10k, friendly service",1
363114,ChIJ55opEx0o1i0RlGEXd6oRWL8,29d1fe1e6319f60bfec2fb12b244f8cb,5,2020-05-14,"STMJ is recommended. Sells fried foods, instant noodles and various other drinks.",1
293116,ChIJw1KCYh751y0Rnc0gtH6E5CY,23fb5a69d0e83bab2c89abcfbd4c1e2e,5,2023-05-12,"The Baileys cake is delicious, the dark chocolate is delicious",1
292757,ChIJKwB52A_51y0RhQa66yt2Z3E,b99ed1a7845700e5526830f39565dc50,4,2024-04-21,"What you need to pay attention to is the SERVICE because its really slow even though youve made a reservation, the food only arrived after waiting 2 hours, especially since I ate it yesterday during bukber, only drinks were provided and 3 spoonfuls of takjil porridge. Those of us who didnt bring any food from outside to get bored even had to endure hunger there. the place is aesthetically pleasing in the old days, spacious too, the food is delicious but the portions are small and nothing really special, the 12k mineral water is really a loss",1
204228,ChIJ-4qTcwCZZS4RqdyP9nJZhLo,91f2afa880701b1ceb64e81d01776b7d,5,2024-05-13,The place is comfortable and there are lots of good photo spots. And also the food and drinks are delicious,1
343098,ChIJ_8bMfRN91y0RA5KrC2QbMas,5a8912a327a46c05d82cea12d062ef55,4,2023-05-14,Sip,1
465804,ChIJsf8IdoFXei4RONFht555gtk,1e462f02a1539841697ea7c7c5ba4e8b,5,2023-05-14,After the coffee....,1
264969,ChIJk5b1Y8TBei4RLdb6mZBuw2E,6fabce4c76c07b6936add66ffc86d62b,5,2023-05-14,Food okay. Favorite spaghetti carbonara. Just be ready every weekend Just drink water.,1
179471,ChIJ5Y7Vsx8Jby4Ru5nHJiBc7TU,c5daf77eef6d1ee1abdba8564847c145,5,2024-04-27,Good and friendly service,1
114593,ChIJRzMlMACPQS4RrsfAFvQ_7aQ,61038ca49967e59329ea9ee3179a7514,5,2024-04-10,I really like the banana cheese with 2 chocolate variants and the tiramisu plus lots of cheese   youll be addicted to this,1
172879,ChIJyeFFn9w7aS4R9EhUPthmwAQ,c40fa121d0043abfa7f6f8f474f24151,5,2023-08-11,"Comfortable place, clean, cool, delicious food, a little pricey, but delicious",1
324187,ChIJp7PfK-OTeS4RJysjI7_KJ1c,1a04e6baebbe91658567cb14dfb8d09d,4,2023-05-12,"Boleh lah, enak",1
180005,ChIJAet4svKxaC4R-txkYM_UlAg,eca9b36409be4308ef13b2d6639527dc,5,2024-05-09,"Cozy, comfortable place, appropriate food",1
44142,ChIJp9nOcVzyaS4RFBq-6Vd5vMc,983722945cea1301c958957082b9853d,5,2024-05-13,Tempatnya enak makanannya juga enak mba nya ramah semua,1
365883,ChIJRQVi8P3l2S0R6RbZzhIL0qU,ded9c6d79f62392610a035e801d94e9d,4,2023-06-14,Very suitable for chatting with friends Parking: Road side,1
214873,ChIJBdmc2QHlaC4RyRsFmI5-oMw,5468b27f665b437f86933e7d517e10a1,5,2023-11-15,"THE MOST AWESOME PLACE TO HANG OUT. THE COFFEE IS ALSO DELICIOUS, MANY CHOICES",1
451522,ChIJtSuXxbnxei4RAXolRPA0Tpw,c1fd28d844d14153daa6d6bb8b952eeb,4,2021-05-14,Nice to hang out,1
336902,ChIJKaIcHmzseC4RiKuzLExjRTc,17bfd05c839eabc1d6390eb553da2d80,5,2024-04-14,I like it but its busy,1
408787,ChIJaeNfMH7lei4RHF7ooUAby1c,927b990b4c417a574b7833dc2c0846b0,4,2023-09-12,"Daily necessities are quite complete, unfortunately they are only available on Wednesdays and Saturdays",1
437823,ChIJGQ8cEXRfei4Ru0K-3gBZYN0,fa25d4acdff2f632c3ef4138f37943eb,5,2023-05-12,Comfortable,1
451994,ChIJ2QHJZItXei4RA90mgJK_tf8,2072cb9e281295c66d5e420d739d217d,5,2024-03-14,The hotel is clean and tidy and the staff are friendly,1
127615,ChIJO7vE64b1QS4R1mtZpa0SPho,f174b80b25d36c18e293c8cc48bd37ac,5,2022-05-10,"the place is cool, relaxed, the people are friendly",1
393744,ChIJr0ATNa1bei4RsfWil03vGWU,d53c2270f7a91f2fa68cf2fff92d23f4,5,2021-05-12,"Mba Tasya, your business is really cool, the people are also cool, Hopefully you will always be healthy and successful in your business",1
293702,ChIJ1cEhyTSHeC4RezBuWouJNB0,ab622e2b787b47183b8a383ece877ce9,5,2023-05-12,Its quite delicious and the view is beautiful and beautiful.,1
216597,ChIJjcX8uoEtby4RK2EHetLYJ6k,eab2d3e684c6fcff39d3926355d2afdb,5,2022-05-15,"Coffee place with a cool view. Open until evening, so you can hang out while watching the sunset. Great",1
366569,ChIJYce5pmDn2S0RvZbiTIcnh0Q,6a869951536bed21fd994ddba19ed3c9,5,2021-05-14,"Try the menu and feel the sensation, guys.... Anyway, you have to stop by, guys",1
199106,ChIJTQSoF_AHby4R3gD7A0TK1cI,b0e0d030fa5a2f54163fd1263b98eaae,5,2023-11-14,It feels great,1
257239,ChIJXTuegfd5ei4Rv6Qdd5X5sSg,687d6f139ddd55cc0a5d12951acd0555,5,2023-06-14,Really recommend for a place to work (free wifi) hahaha,1
456094,ChIJT802CndXei4RnbV0q9GPMfc,77c125ae141312686e8e0fabe7e0e809,5,2020-05-14,"Like back in my old days, the songs are sad, the menu is delicious and murmeerr",1
120731,ChIJc18VKcMHQi4R9nKbPZUyu7w,d3affdeea6d344421387b9fe68f4da0e,5,2024-04-10,The design of a traditional Javanese place combined with authentic special food is basically MANTRA (THE GREAT TASTES...),1
203094,ChIJQcgpeHXFaC4R5RCrvC7Vzk4,a464016b471e258dc4d40acde8f1b504,5,2024-04-15,"The food is delicious, I really like the coffee... And the place is really homey and makes you feel at home, comfortable... good luck... You have to try it",1
391925,ChIJK3wfEXJXei4RZw5i0B4BRbE,7e44cbbca40bdb9405c48ed39ccc79d2,5,2024-05-09,"Friendly service, delicious food. Quiet place Suitable for relaxing",1
174544,ChIJ31MgrcHzaC4RnP0XSu1yrbc,f89213d500eed38aeb919c871d45b6b5,5,2022-05-11,Joss great,1
114800,ChIJjUWpinblaS4RZkR-ioJOTXc,db34ef4aea1362f90b03c39b297c49ef,4,2020-05-10,"Co.Koffie is a drink and food shop that not only sells coffee drinks, but also sells other drinks such as soft drinks and sweet tea. The location is easy to access because it is right on the side of the road. Vehicle parking is a bit narrow and the shop space is not spacious enough. Just a suggestion, add prayer facilities (instructions) and special toilets for visitors to feel more comfortable staying longer, if necessary, make a lesehan in front of the shop.",1
460712,ChIJhcPAtUNXei4RiPIghpt15JM,801f6838c75ca4644e88f5d0fe5bebc9,5,2024-02-14,nice place,1
63653,ChIJ58kGDcP1aS4R_7r0TVm6ttE,fddc3dfabeaaecb88109417314584872,5,2023-05-10,The cakwe is deliciously dry Especially if you eat it with jali2 or tausuan (peeled green beans),1
324407,ChIJ6U1qCwyBeC4RpKnUN_l10AM,66c849a103133023c81026da33e40426,5,2024-05-11,"If youre on holiday at a villa/glamping, its better to order at @grillbatu, its guaranteed to be fresh so you dont need to worry about it going stale    apart from renting grill equipment, all basic necessities including cigarettes are also available. So you can also order",1
207920,ChIJR-PdSzNIaC4Rws8kExuw2PU,603fa6cb7624496ca8cf32529367a8b8,5,2023-12-15,"A fun place to gather with family, friends as well as reunions or social gatherings",1
157050,ChIJ37uaUQLlaS4RTZbmot2jTKQ,7fe74494a241f532b4cb734245e6a47b,5,2024-05-07,"the place is comfortable, the matcha drinks & snacks are delicious",1
68147,ChIJNy16843taS4RF9NqqNcIWqg,a532f7b54d00c9245347a6bc9bc120e2,5,2023-07-10,"Delicious food, cheap location, also comfortable",1
106578,ChIJW27_E1T1aS4R35H325s9z-A,f27733f0e6859875af248355c225f58d,5,2023-05-10,"The place is good, its easy to find the place, the food is delicious, top markotop mini martabak",1
404736,ChIJQ6PY2tVXei4RporlvApe5qg,9cf4343b26c08923ad5061520546b0cd,5,2024-02-12,Nyoss,1
197706,ChIJmfXkRjc_aS4RDkmdq945y8E,3db2ca114ba90270bc9213ef21e0d1cc,5,2020-05-14,Nya kitu lah...Surantaffff,1
60018,ChIJsd3oLL-LaS4Rlcb2QirRTUk,b132301c16b6f14810357d21bf6ad495,5,2024-05-03,"the place is comfortable, the food is super delicious!!! Highly recommend for those who like Japanese food, try it here!",1
43598,ChIJq19a01bzaS4Rc0uWM3wG7kg,09c2ea4cc745f8e2b8d60ca116905e46,5,2023-09-13,Mantap rekomended NR COFFE PREMIUM,1
441028,ChIJpfSbF-H6ei4Ru1tJW-Sx9Yw,34437728a074c33981016f19a0357bc5,4,2024-02-14,"Pretty good for the market in Kulon Progo. The menu is also complete. Recommended endi steak. The location is not far from Wates city. There are lots of car and motorbike parking areas under the trees. There are quite a lot of tables and chairs, so you can hold an event. The facilities are also complete, there is a prayer room, toilet, washbasin and baby chair. The steak itself is quite large with lots of sauce. Whats most fun here is using fresh cut vegetables, not frozen. The potatoes are also cut into wedges, only given 2. The price is standard. The taste is also standard.",1
117154,ChIJa8JGu2lGQi4RJtzkuNBqCUg,2af90eb86db53d1b5ee22780d812ac22,4,2023-05-10,Just stopped by to eat meatballs,1
256898,ChIJQaHeUPOMei4RH35xHQQizc8,dbdf1d5a5da1289f8ccf497b9382b6ce,5,2024-04-14,"It tastes good, the price is good... families and children also enjoy it, just paint the place and clean it again (like fans, etc.), light up the lights more, and arrange the chairs more neatly so that visitors are more comfortable... keep up the good work!!",1
189562,ChIJicgsep7haC4RJG4k92MbxXM,7675204eca89accb4261edb1fb816517,5,2023-11-14,"Saung Pengkolan Restaurant is located as the name suggests, right on Pengkolan road, next to Darmaga Sunda Resto. For food, I ordered Nasi Liwet Complete, the taste was quite delicious and tasteful, it suited my taste buds. And the portions are very filling. The service was very good, I was served straight away and my drink order came straight away 5 minutes later, food orders came relatively quickly from the moment they were ordered, around 30 minutes. The atmosphere is very beautiful, because I came at dinner. The view of the lights on the opposite side of the entrance is quite pleasing to the eye. Kid-friendliness: There is a playground for children to play.",1
454847,ChIJL5OZmk5fei4RcKcPLjWq2yI,c739991b94e77de37cad018980da5861,5,2021-05-14,Soulful coffee,1
343542,ChIJ9fwu-US-eS4RRqtswdent18,50d0af3d36a52aa1f219a36fc4d8ef88,5,2022-05-14,"The place is comfortable and the food is delicious, authentically nostalgic and the prices are very affordable for the people",1
340842,ChIJG1qi8Qgp1i0RzeaexB9qKlg,e12085c59f051ab3a0f4ba84fdc63027,5,2024-05-12,"Kopitiam with a really Chinese feel, the food and drinks are delicious, the atmosphere is very good, you can choose wherever you want to sit because the place is spacious. For satisfactory service. Dont give up on coming back here again.",1
354404,ChIJY-NWyzuDeC4RMDXE3MDLDPA,1fcf18ab9befb471d10978424d83fdc6,5,2022-05-14,The kebabs are delicious. Thats great sis,1
263085,ChIJq145Dboldy4RUfDW6lfWPVI,6dca5b84edf0572920db53f8f0b48588,5,2023-08-14,"The place is comfortable with a semi-outdoor concept. The food prices here are standard, just right for your pocket",1
313437,ChIJ7fbq-gqBdy4RTq3S7xY_GIQ,610b5a5546cfdb9554457b5280d11b65,5,2022-05-12,"The V60 is great, the recommendations can be set to soft or strong, there are many variations of snacks... Yes, so far its really okay for a place to hang out or just have discussions...",1
307727,ChIJjdIKpdsNeC4R5S62b-O7Q-Y,80458a4a1bd11ed4eec53f7077054f78,5,2023-05-12,A comfortable place to drink coffee while hanging out and the place is spacious.,1
217485,ChIJGYbRwMeZZS4RUy1wm-kpVNg,c7e1d3c268f9d242534db41651f6474c,5,2022-05-15,Chocolate Chesee,1
447202,ChIJSUJVXSb7ei4RbLdH59d-rLo,29c6a87d5f089865c8c180a486086b6e,4,2023-10-14,The place is suitable for hanging out or doing assignments. But the bathroom facilities are poorly maintained,1
94368,ChIJxwVI10_1aS4RBMumEaAvOw8,f6e8887f7af4ec8763088a46d238cdca,5,2023-07-10,"When I entered the place, I could smell the aroma of delicious spices and I imagined it would taste delicious. It turns out its true that when the fried duck is served it looks very appetizing. Complete with vegetables and tempeh plus 2 types of chili sauce, its mouth-watering. Especially when it comes to midday, its not that hot anymore. The rice is soft, just the way it tastes, and the duck meat is really juicy, even though in famous restaurants the duck is sometimes hard so Im less impressed. The owner is friendly and humble, asking questions about our feelings and input. The best is highly recommended. The place is a bit inside the housing complex but still worth it to visit tho Suggestion: I hope you make the chocolate drink thicker",1
31712,ChIJWfH6f_n3aS4RoUOOla7a1Mw,5b5ac1f3773d3e3129aa9363dd9e5213,5,2023-05-13,Betawi owns it,1
112535,ChIJie1ZJSmRQS4Ro-syokFwDHk,69e876038537e6df48ce4b2e511ff54d,5,2024-02-10,very solid indeed,1
435623,ChIJxXIil7tXei4RgBa035fMkKA,a3f6162411686ca35943cf64221a8fc5,5,2023-05-12,"Amazing taste, good service",1
