,place_id,review_id_hash,rating,published_at_date,english_review,sentiment
65113,ChIJBSEKiMj3aS4R0tNZQVr70gk,dcc59a555eabaee4b37cf995235b400d,5,2024-02-10,"The place is comfortable to relax with friends or family. I tried picollo, it was delicious. I like.",1
215591,ChIJN00oaoWNaS4RXnCZ02zv79A,03952f7ff99d3ee3b12560d96d542849,5,2024-02-15,"Second time coming here for a friends birthday, apart from being a place to hang out here you can also book a place online, the food is also delicious... great.",1
185368,ChIJUVRVp6xTaC4RGRqacTzgAkQ,919898df16d05f14c84200dbef5a9484,5,2023-09-14,"The combination of milk and fruit tastes really delicious, suitable for all ages and suitable for various situations. The strong taste of the green tea makes it delicious too... As a result, I want to come back again for snacks at @tekun",1
27793,ChIJ4TIKU_r1aS4RjsnBFcXGQ-c,f9f503f9adfe831560ecb1cccfeceb1c,5,2021-05-13,"OK, the location is strategic",1
61975,ChIJ0x0kErL1aS4RPhkUMoMI6HA,a1a8b8bd75f03a0d980aea64f89ce9ad,4,2023-07-10,Not bad,1
208735,ChIJCRveOKWZZS4RggeMPRf8fak,28dc0fd636c28b5ac0c7914939663f8f,5,2023-06-15,"Great place and friendly staff! We went there on Sunday afternoon so its not crowded but the night before all the places were sooo crowded. Will visit here again, they are also dog friendly!",1
26319,ChIJMQ7Jtg_1aS4R8MBNfohV2PU,c2053a3040ac9add95349fa0c3b1a798,5,2024-02-13,Nice coffeeshop in setiabudi,1
85406,ChIJ1cLxsV75aS4R_ICjJqYshYM,28e9ee033191ddf9a89b42be4b4dcedb,5,2023-05-10,"If its your first time coming here and youre wondering whether you can dine in or eat on the spot, then yes, the answer is, ice cream on the 2nd floor there is a special place for smoking and smoking too, its just that the place isnt that big and is limited, the rest is okay, standard for other mixue outlets.",1
383884,ChIJP_8xj-VZei4ReqNS9B6XhWI,dae256002d52f50457ec3c6eca1d41ae,4,2024-04-12,"made yesterdays bukber c... the food was normal. on the menu there is fish fillet but the fish fillet has been replaced with chopped egg... wow thats really far away. t4 there is only one food pick up with so many people. The worst thing is that there is no mineral water, only iced coffee which is refilled twice, which takes a long time to wait. for T4, its okay, but the service and food are a bit disappointing",1
394447,ChIJKy49Gz1bei4RIIgLZZVfCLs,6ede8efbcbbdcda665b0a135a8c23904,5,2020-05-12,"Sruputen cafe has a great menu, you wont regret it... Ill try it",1
172834,ChIJGTRv9TjFaC4RulUcjaJ3fUo,ef1dcc9885a1f7270df21bd919de10ca,5,2023-08-11,The place is clean. The staff are friendly and there are play facilities for children...,1
56010,ChIJVcDpbif3aS4RsVtYNLTY0zA,c9b29b55e76c65375c40ef40bbb65fda,5,2024-03-10,"IQOS is complete, good communication, Fergian",1
267080,ChIJQTY-g8dLZS4RJMa0E2YbF00,ce7e57394ef61a3a573383ba20c314e0,5,2020-05-14,"Wifi, stable signal, ping 17ms Open place, strategic location",1
251928,ChIJx_zUYOlfZS4RCPzFv4pNH_s,5173b0e5526ee872b60d9e8468d2f2eb,5,2024-04-14,"Complete menu, affordable prices. Satisfying taste. Friendly service. Pokoke is really recommended",1
326391,ChIJL53c66AbeS4RvkzojPDVKMA,4306b20ad12019bd2f6cacead57a4b62,5,2023-12-12,"Cozy atmosphere, fast service, delicious food",1
365717,ChIJd5G06ASfeC4RN0G4Yy8-GEQ,cb3e94cf1e60f486b11fdd4696286060,5,2021-05-14,Its a nice place to chat and relax...,1
257189,ChIJDXykR46Lei4R0bRaBD5NPLg,d2fe7b6ef3b9de3587006181d6e32c2e,5,2024-02-14,Good local food resto,1
415656,ChIJnXCtxDJhei4Rq49kpw0_Ff0,e8a82647ce392b410a78285e440d36e3,5,2023-10-12,"Everything is delicious! Javanese Coffee is highly recommended, the creamy type.",1
223585,ChIJYwtDKUcXei4RtrYzWP4veSU,45b4165e225a0ad2fe898ebc933e944f,4,2024-04-15,The taste of the chicken is still ok... but salty... the service takes a really long time even though this is classified as fast food... For drinks its pretty good....,1
226787,ChIJNxMZQjaHcC4RdJ17NZqSqGc,b18eca3708501735bf6ec12e22e09500,4,2024-02-14,"Maybe it just happened to be quiet, a rare opportunity.......",1
356920,ChIJ783yzw_71y0Rl_ClETjn_as,689fa5c03eabb89965e87d21dd9649e6,5,2023-05-14,Good comfortable..,1
30971,ChIJUeAnfpvuaS4RB9aIlnz0-Po,288068b015883492e92c3a87fd5de7fa,5,2020-05-13,"There are lots of coffee variations, there are various kinds of tea/chocolate drinks too so its good for hanging out with friends even though he doesnt like coffee.      ~~~ Helpful",1
39119,ChIJiUXkVgDtaS4Ra7p6YMRcFDM,62cc0ee213c870df5ed02d4972b3931a,5,2024-03-13,"The price is affordable, the taste is really OK",1
173808,ChIJ0_aiAKQWby4RVUeJqDDZ8-s,92a976deec4d841c7d9d187a92e06ba6,5,2022-05-11,Okay,1
263275,ChIJBSibMq-Fei4R-RwmqwzQuNw,ac9078f2d38fd9d79c8f7ba236a9ef23,5,2023-05-14,highly recommended,1
50919,ChIJG74I3Pj0aS4RW8J0a9UU-1g,b3c120bce5675b99b3ca1d7c5854cb24,5,2024-04-26,"Family favorite food, comfortable place at affordable prices. Duck with kecombrang chili sauce and green chili duck will make you addicted..",1
404270,ChIJxfNfbV9Zei4RjYBE6Xx51YI,2c43fd20ae14f64141dc22cb6903c53b,5,2023-09-12,"The place is cozy, the afternoon is cool, the atmosphere is really homely, everyone can hang out or have a social gathering, the menu is varied, the taste is good, the prices are also good, per person costs 100 thousand.",1
127883,ChIJJ4PuQgb5aS4R-6-S-veaxf4,9040ee982f22c60c9febb1582e5f1892,5,2024-01-10,Great,1
87652,ChIJWZhfqPUdai4RQ-uBCypkREk,83f73edb2e3728100d91e02e808103cf,5,2023-07-10,"the food is delicious, worth trying! the staff is friendly",1
58460,ChIJEaOOPaL1aS4R2hohwJR-yuQ,b19f2060bb6c55894be96c90d94a32ba,5,2024-04-12,"Coming on the second day of Eid (11 April 2024). Ive tried Greyhound before, but it was at Gatot Subroto and it wasnt a pleasant experience in terms of service. Second try, try at Greyhound Menteng. And the whole new experience      . The first time I came, I was greeted by Mbak Aurel: Even Mbak Aurel helped direct good photo spots at the outlet. Then my table was assisted by Mas Bagus and Mas Ito; and there is one more person (sorry, I really forgot his name)  . Mas Bagus chose a suitable menu for my mother that was safe for my parents taste buds. Mas Ito is also extraordinarily friendly in serving food and drinks. It is very visible that everyone who works at Greyhound Menteng does their work with joy; even though its the Eid holiday and they should be going home. The food and drinks are also amazingly delicious! I order : - Matcha Granita - Nomyen Granita - Thai Iced Milk Tea - Coconut crepe cake - Thai Banana Fritters - Crispy Raviolla (BEST!) Definitely will come again with pleasure",1
394153,ChIJec4lKc37ei4RCJDK0Byd8Lg,a8c6eca906b57fc8bf3bf6da95217484,5,2023-11-12,"Tea and coffee are all delicious... good ambience, spacious, friendly staffs.. the best in essence..",1
234773,ChIJ28TtxGFqZS4RMJortgVK5DY,5dee1d2b82ca33c370f3eb85dc55a28c,5,2024-04-14,Food,1
450562,ChIJS-MrFg25ey4RaNv3aGhB7Tk,1b1b7db06763d1a4eb4fe40dc03cc785,5,2023-05-14,"Friendly service, + beautiful children",1
38013,ChIJ05y6iBjtaS4RjVZVOEEHigs,b117b7e0f781b6a78302a3a1d2c7cf58,5,2022-05-13,Ok binggo,1
92887,ChIJ46S3MqDyaS4Rs2dyqYtqaTQ,744581ce28d845cb9dca6b183035239d,4,2020-05-10,typical Batak food. The arsik goldfish is quite delicious,1
446330,ChIJ--6KH6NXei4RsxqyqmnEyiI,41159bf4887268e9499e46e6abfd50eb,5,2022-05-14,Drinking and hanging out at night,1
308461,ChIJFZfFTC2HeC4RHwOiFcWZzWA,eb777d36ef2caa81158a9e4e08d13939,5,2022-05-12,Nasgor is recommended,1
342342,ChIJWaxiG8-idy4Rxo0G6z97hHU,666cef068f06cb7042d4ff2d988ffcde,5,2022-05-14,Great for refreshing breaks,1
363219,ChIJM3okqufteC4RaKHb8kkzQDE,29794ba9241075642e16fe1268da8db8,4,2023-11-14,"Try the red bean matcha sundae, its just right. Not too sweet",1
327175,ChIJkxQq8I-CeC4REe6NxQs3LxI,0ee83641986b4bb70cde8b095c8fd6f4,5,2024-01-14,Nice,1
279754,ChIJdQBedXiNcC4RhQ-8GUFpwG8,638a4de912fcaeb99e1ccb40daa1f622,5,2021-05-11,"I like Kobii Ice the most... Makes me addicted.. When its right when theres a promotion, it feels like its really profitable to buy at Kobii, it feels like a cafe at angkringan prices...",1
183310,ChIJVVVVJVnmaC4RG8JaOjv6os4,f7d566d92b057567177b0336546db0f5,5,2023-08-14,"Good for relaxing, chit chatting with friends, or doing assignments. The atmosphere is warm and pleasant, usually weekends are busy",1
278736,ChIJuQc_aNUlcC4RXlVAOT27Iy0,30d4f5b9d78eb0912f75c58eed0bdc18,4,2024-04-20,Just like the promise of the soul of other volumes There needs to be menu innovation so that customers are always satisfied,1
371346,ChIJB290gbZXeC4RYFwohpina2s,4dccf51542a4440c13f548540bbe48f7,5,2024-04-16,"The food and drinks are delicious, the place is comfortable, there is a special smoking room, the wifi is smooth, the bathroom is clean, there is a mirror too... the price is according to the facilities.",1
325744,ChIJffxWT6Jh1i0Rs2DNEpwDwJM,497d45998b610f2f7e5beb23bcfe6ccc,5,2023-05-12,"New menu boss, really delicious",1
74451,ChIJka524dKKaS4RMkJPd58Ha34,18f32630763264a6d296995b95366dd6,5,2024-04-10,"Nice place, great coffee.",1
120764,ChIJzd7uAh2LQS4RAkixDqGFFvs,fa29cdc206ca38fd346b7403a9c246bc,5,2024-02-10,"There is no cake (   ) cake and coffee are delicious, you know, hopefully next visit there will be cake Kid-friendliness: The price is not suitable for female students",1
334871,ChIJh0oQsZ6deC4RZFzs0KydDXI,114ecc1d32bf633e0cadd8d2a073b832,5,2023-05-14,"This place is nicely decorated. If you looking for a small place with a warm nuance this cafe is suitable for you. Even though the barista using manual tools, the drink taste good. I order tes blend and it taste really nice with hint of chamomile. I also order croffle and it also taste good. This place also have a strong wifi signal. Hence you can open your laptop and do your job here. But this place have no air conditioner, this is not a big problem though because the weather in malang is cool. I visiting this place in the afternoon with my friend. We had a good chat and good food. Overall I like this place.",1
123086,ChIJRz8w3GUlQi4R4Z30C-fqmCs,2dfe3c8209a0afc901b557f5b163fee7,4,2023-11-10,Like,1
278234,ChIJs-IeFIiNcC4R6FpyVS_O6I4,6e092bf9cb474325e9d46a7a9f6a5935,4,2024-03-11,Actually really like his cooking. But the presentation takes too long.,1
12024,ChIJc1ywzNP1aS4Rzaihc3MUqM4,503472130eaa4ec1acc4d0903b35a375,5,2023-05-13,Cool,1
133536,ChIJpXkIqwXlaS4RwhnH3ndR9t8,3dbd17b188ac94c04b0a0daaca48c7b0,5,2022-05-10,"Kane , saik tmpt nya",1
426888,ChIJeSRxrOlbei4RZoUOsJoKhDE,d235d6580eeb65ffd54a2b05e184f600,5,2020-05-12,The place is comfortable and recommended,1
218087,ChIJ51_I1Xg9aS4Rl3DHrJT4y9w,1ad531b26def61aec51a1a825bb70f50,5,2023-05-15,"Segeer is delicious, the service is really good",1
247137,ChIJRS8Voluhei4RLsdxSrLYtDg,7b49bcec987b2d5ebd1c1cfdcbedb8e9,4,2022-05-14,Pretty comfortable,1
260168,ChIJgfnt0OQldy4R2jiLUAbkLoc,0ccdacf6c61136e49454a67df113f1b2,4,2023-10-14,"The coffee is worth it according to the price, the ice cream dessert is often empty even though it is delicious, the taste of the carbonara must be evaluated again.",1
451286,ChIJc3RUEu37ei4R07L3AXi_ryM,b6f3b4f27d156c1e94e5863c5d8e8435,5,2023-05-14,"Excellent. Josss. The atmosphere is good, the food is also delicious",1
236107,ChIJA3crvTNYZS4RBISui2kDu0w,7006c852c87983715a7622b13a3425c2,5,2023-05-14,"LIKE THE PLACE, especially since there is a lesehan, its not hot at all, its quiet, the food is also plentiful and cheap, I really like the ice cream!!",1
145357,ChIJ0THvWsL7aS4RbyJzYBe2r8c,fcb583d8ca1cb31f6238dfdaddcb7c9a,4,2023-12-14,"This is very cheap ayce di LW, with Korean theme. Well you get what you pay, each person is around 130,000 incl tax. Drink included. They serve chicken and sliced beef with non spicy and spicy choices. Spicy option is actually not spicy at all. The stove in front of you will be filled with water and meat will be put on top of the pan. Meat served by the waitress but they will refill for you, and many times they will approach you and check whether you need a refill. Staff is kind and helpful. Other meals you can take yourselves but not so many choices. Remember that this is low cost ayce. Overall i like this, good option if you like to have light food. That amount of money is basically a standar meal cost in shopping mall. So no regret.",1
440023,ChIJT6lrVZXvei4RZKZb0n82zmM,c10a65e47cb6946a8e916ac6488ce16a,5,2023-09-12,meatballs are a mainstay of muantapppssssss,1
309900,ChIJQRZzpmr91y0R15L1xi4pN-s,e8edebeac8a2a246ecd337cf7894bff5,5,2022-05-12,"Complete menu, cheap prices.",1
4908,ChIJvVPyAonxaS4RO_IwkdRSeaY,703263ee52ab23d0deb89e07da0d3feb,5,2024-04-29,Fun place and ok food,1
180220,ChIJZXr3OjIfaS4RWd-5C7nVVDo,31503c3cf3788658b6b3b76a48078cc6,5,2023-07-11,"Great,,, great,,, great,,, menu, place, prices really recommended!!!!!!!!",1
433231,ChIJKSrazbFXei4R4psCoeWrtC8,5bb05d774b34b1467c7b2ed419c844f6,5,2020-05-12,"Tempat bolos dari kantor, soale kantor e sumuk. Ning kene ngisis sisan jajan es, nak dek.",1
332889,ChIJT-757kP91y0RQJVmFL8vSGs,f7a98bcce3fb8d8d26aff4fddae324a2,5,2024-01-14,mini cafe recommend West Surabaya area,1
85923,ChIJU5gSfcP1aS4R2GMJie29weY,ead6bed9ac86dc609c02786a0f960935,5,2024-04-10,"Our familys regular restaurant has been in the area near Pasar Baru for decades. Favorite menu: Tripe finger, Lindung cah fumak, fried chive noodles, mun tofu leek son, fried rock frog in butter.",1
322485,ChIJTQleNH_71y0R3SxoXNTaIgs,9afa87e58fb6b38fdc65a5bb3d1c0076,5,2022-05-12,Good service,1
356534,ChIJqY5dZVj91y0R2ptCSUTiNHQ,ae2517d0cf15c435987a01632aaf7a19,5,2021-05-14,Its delicious and not expensive to eat and drink,1
193061,ChIJmRoDOc3yaS4R1RMLzxP3VDI,ed6b6db51d087afb514c407670a7aaf4,5,2021-05-14,MANTAB BANGET JAJANAN NYA PRIKITIW,1
130240,ChIJXfT0SVQhQi4R7sz2MR7IEv4,05ba8bbe7f3044ba24052d78e43bdefe,5,2020-05-10,The price is affordable for students and its nice with free wifi so you can browse and update status,1
265632,ChIJwW40huwZei4R8grZ2VUj6wA,0538e3ee0616c598c094e5748dcae986,5,2023-06-14,Es teh dan es kampul paling mantap se Karanganyar! Kalau bulan puasa byuh antrine sampe setengah jam krn larise.,1
326073,ChIJ9yUUy8-TeS4RWg0bMtpJsGI,6cc29055da18121f6781ff89dfefafe1,5,2021-05-12,All kinds of home cooking,1
433332,ChIJVXgnzQlXei4Rhbrlyu1vSXg,217dac428b333ccc10bad2c973db4b83,5,2023-05-12,gek bukak,1
146732,ChIJvemjZUP9aS4RNWZxp48jB1U,8d2693bd52fba44702f19ef2c74d1faf,5,2020-05-14,"Very fresh, the lemon is top",1
198982,ChIJ7xPq7hNTaC4RwHmky8Po-Qs,1f1c873faddd6b6cfca3219b788c0cee,5,2021-05-14,The Fried Meatball Noodles are delicious,1
83532,ChIJrWTiHtYfai4RRrPrxTerMtU,7271668b37c761f31bc8c5664def234f,5,2023-09-10,Absolute banger seafood! Nothing hits home like that!,1
401429,ChIJXYNPkAFZei4RBo65Efufx30,6fc01ce832f43dc06ee1296a86d86a42,5,2023-12-12,Cozy place. Friendly employee (Barista and Team) .,1
48749,ChIJN1Pzxo31aS4R54gjEt4JP8U,d01d61c4c36adeef31a6608168cda123,5,2024-05-10,One of the Ice Cream legends in Jakarta...,1
407920,ChIJLx-ZKVdYei4RCfkGshHMXUU,edaace309004c86033d9a9ff4e48fbd1,5,2023-12-12,"The fruit ice and doger are cheap, only 7k, refreshing, not too full",1
65518,ChIJMyH3hZWNaS4RIKPc8p0c4rY,46af61dbc2917b49191c4dd53d4f6fa1,4,2023-05-10,"Good, while 4 stars first",1
438256,ChIJX6k1s6Ffei4RtBcCYKy-hO0,fd9348c87ade561c4ab25714ecbd9909,5,2022-05-12,Its great to be able to order Gofood,1
324147,ChIJV7zL93JzeC4RndXzYESWST0,430a98535cf2fcb8627cc8c3dfde5bb7,5,2022-05-12,It feels good,1
397913,ChIJqUrnpyFZei4R7WqbehJxvVM,490f96232fc1b09eed31fe6df7788042,5,2024-04-21,Ive been a subscriber for a long time & its always okay,1
366721,ChIJF0YnmK6feC4RQjTcuHCWfmQ,fd180b324c33da3bd245a9fd74a9d2b0,5,2022-05-14,A comfortable place to vent,1
206627,ChIJzUz9w2zlaC4RVtgRw14iSB0,f727cbbe2d06bf8492c87f8dcd099024,4,2024-03-15,Ok,1
40593,ChIJxUbKLRfzaS4RcJDx5mY_w64,1429d2eb0cc19e15f23862a4841c65db,5,2021-05-13,EXCELLENT,1
23279,ChIJK2gSTIvtaS4R4nAoN8P2e_o,c29179c967c77b26af099444d1420284,5,2024-03-13,Its drizzly this afternoon.,1
366049,ChIJZxOcrIAp1i0Rm00HfLUnUxg,685e734a5af9db2d21207f3b90f71fb2,5,2023-08-14,Steady,1
277486,ChIJVzAyOv5Bei4Rpiq2YjjyWrc,38624637f0a1865b69c970098befec64,5,2024-04-27,"Good for hanging out, about the taste of ordinary food",1
175138,ChIJGyOnM4Nfby4RNb3BSD_0Fbg,9272f81f2bb0bbdb3c1e736435428b1c,5,2021-05-11,Excellent,1
69308,ChIJ_wQIfFSNaS4RKinH5WnHMU0,060b59b8b130b3265c7e0073a53f05cf,5,2021-05-10,The reseller prices are cheap,1
421227,ChIJqXBs1-JXei4RaHoXCtU2XWE,3a4a4b799e85d896de77c083423d2b9f,5,2022-05-12,There are rabbits who often play with visitors,1
291860,ChIJ_chP41351y0RwBPG51Opm4M,6c9826f7a397b692602085694b82c6c1,5,2023-05-12,"The service is friendly, especially Ms. Titis and Mas Aldo, the food is also delicious. Thank you",1
198627,ChIJXR2LunKVaS4RwRcd8BPPPWQ,d180f05f999ff24b49660aeac9b9ab26,5,2021-05-14,mantep om bear nyaa,1
184609,ChIJ386tlsRTaC4RAIjTkvJL7w0,0c38cb31524b405959ff00e5f20ab007,5,2023-09-14,The food is delicious,1
276434,ChIJOcpCrCq1ei4RZYR_oyXE224,918827046de3aa2354400f1342105b9c,4,2021-05-14,Fun to hang out with Strategic location Near Mini Market,1
443391,ChIJS1_11If7ei4RCFE03ocEGh8,bded0f469df7330793cccdbc61e358f6,5,2024-02-14,"The food is delicious, it tastes great... really recommended, because the atmosphere is also ok, the place is also really ok.",1
392755,ChIJuwufHJ5Yei4RyP-4K0rUj1U,dbfa480c7dc92c31f01d02291b96922d,5,2022-05-12,The duck is solid,1
264448,ChIJZza7y5vBei4RPhwMjeMWuDw,1d071e2b944b7e3c5075035d9ca9c05e,5,2024-04-14,"Legendary Dawet Coan ice depot They dont just sell dawet ice, there are fruit ice, sticky rice tape ice, sticky rice tape coffee ice, chocolate ice... Ive tried them all, nothing has failed",1
456351,ChIJxZEzyU1Lei4R89RI-7VH2SM,6740a7a61f29d894d158c24ba4b3c6f2,5,2022-05-14,Sotone is fresh.....the iced tea is thick......the mendo is really delicious...its definitely a really cheap price,1
460610,ChIJfaI1-nFXei4RMCczFo1Z_jk,da1f8309f3e255472d585ce615283b51,5,2024-04-30,the owner and employees are very friendly....and the food is appropriate,1
82423,ChIJgbbsRoX1aS4RvRbkyT1rypA,1377fd0cc20b9dc2163eacde50b7145b,5,2024-05-06,"Pretty OK... parking is difficult, there are only employees who want to look after the car and let you know if there is a parking space in front of the cafe",1
286625,ChIJSxq6p_GxcC4RWCt5e196tBs,2089a01e33fa9a6ff313b7accfda33b3,5,2023-05-11,"A fun, comfortable place for quality time with loved ones",1
222161,ChIJESN8QYYWei4Rcx_G74VgkzU,0ada3e06a363de26b05f23517adfb2fd,4,2024-04-24,"Cheap and delicious... childrens favorite crispy chicken steak, unfortunately the service took a long time",1
8972,ChIJ39CMZPz1aS4Rr1ZnWkGflWQ,c9435153b4a01c327a89c350d73d3037,5,2024-01-13,I recommend the burger and chocolate drink menu.,1
65980,ChIJQXQVg233aS4RmAEfOfpfB98,1685153ed899d95fed5a8ea3627e7879,5,2023-05-10,"Recommended, the food is delicious, the place is also clean",1
291312,ChIJ0fZ7ALop1i0RMEoCMBwJDj4,95b57eff3339691397e6868dd2f2ff32,5,2023-12-12,Super beau restaurant le decor est magnifique!!! Les employes super gentils et accueillants!!!Et la soupe etait excellente!!! Je  vous recommande vraiment ce restaurant!!!,1
154650,ChIJo3lRcVbvaS4RRD3sE-tAvh8,97739db0919133992f6915619c9c7255,5,2023-05-14,"The menu is delicious, the service is fast",1
23511,ChIJ67iIOMbtaS4RsZn3NgIKoKM,925ed57af1e8e3b4c63b56ba142515c1,5,2024-01-13,Recommendation,1
422670,ChIJhVzk8ntZei4RyPNK3r395yY,72a49f348268eacdee05cfd36d2e9f7a,4,2022-05-12,Good,1
399979,ChIJp0uKh773ei4RGsC6hXX7XQY,592e814f8d6a7222e92ac576d5418cad,5,2023-05-12,Kid-friendliness: Lots of childrens play & open grass,1
283683,ChIJeQ-Oa5tBei4Rj_ZQOmM_HE4,2b05269b4e52b38dd6d6809090ca3b01,5,2023-05-11,"Those looking for a different place, please maper Wedangan Bejo Klaten",1
100706,ChIJhaZWqQvtaS4Rf7V6rh5PA2k,42de8734adab6e866c0ab5b5c70c94d3,5,2023-08-10,Great...his brother is great and really friendly...,1
29539,ChIJrQBNoGj1aS4RDQyV1OkjIjI,b535b9440fc357bd04201f55a9ff7801,5,2024-01-13,"The place is nice and theres a DJ, the service is friendly.",1
65047,ChIJj7x9wQGLaS4Rai6OpBSAXQ8,067fa05e601544d442ae3d82e1d0b21a,5,2023-12-10,"The cafe is comfortable for working, studying or just hanging out with friends. There are 2 floors which have different ambience. There is a prayer room and the toilets are also very clean. The price range for food and drinks is standard, some items may be a bit pricey but its still worth trying.",1
239104,ChIJN9-7vJqpei4RDhxXN-lnlVU,5cc40572f762a553f9751160d2588847,5,2023-05-14,"The place is nice, romantic, more suitable for going with a partner, entry is free, lots of choices on the food and drink menu which is quite good, you can sit at tables and chairs, there are also chairs on the grass, but the seat cover is not wide enough so you dont have the freedom to move around, but its still recommended",1
318796,ChIJj6bVFj9reC4RfgBbJMrZEWA,5b4cf71af82d3af387feba6d7a94c14b,5,2024-04-28,"The location is easy to find and reach, in the same area as the Jombang Central Hotel, buy breakfast and eat at a very comfortable location, the taste of the food is delicious and the price is affordable... I happened to order one package of food and drinks, namely rice dori chicken chili + chili sauce, I forgot. what but fresh and suitable after eating these dishes",1
390016,ChIJNZr0a_dZei4R_nXWIXGjvHI,9f577d7b39aca9f2a7520c4da1c063f5,5,2024-03-12,Suitable for a small hangout.,1
100348,ChIJJ8oH1fQhai4RUIXmBN1oHTw,6a86f2907c57b8e1c227d8c3aa1e6aeb,5,2023-05-10,Excellent,1
400327,ChIJbYp1veVZei4RsFlIyr5QaVk,1277b15f601df5340de7f08d384807bd,5,2024-01-12,"Great, everything is delicious.. Dont hesitate to come here..",1
304478,ChIJu5bj_aaTeS4RKLo1OZqdpUc,c39ee8d1667de959648dd62c8ba6bc5f,5,2023-09-12,Itu hot coffe community,1
288706,ChIJ2f_DhVFFei4Rgfy19LuijYU,4bc22b2f57e0238dd2fcb5867f2a20ff,5,2020-05-11,a cool place to relax,1
418501,ChIJMSH7IKNXei4RZwrjtxaPICs,4b575d93f722aa4bc08bc9c095bac0cd,5,2020-05-12,Coolnn,1
43713,ChIJ35r29T31aS4RJfH8qH1GuP8,da73322ae7ab0c39a5c1263cb1cd409b,5,2023-11-13,"Kaget ternyata ini cafe hotel, meskipun bukan bintang 5 tp pelayanannya lebih lebih dr bintang 5   Makanannya enakkkk bgt! Pesen pisang goreng kaget rasanya enak dan homey bgt :( Pelayanannya juga mantap! Sangat rekomen!",1
339313,ChIJb6cgATEo1i0RE3Auzv9FxUM,e31a353bda5f9d1b384714d306fcd8b0,5,2024-03-14,While eating you can enjoy various snacks,1
390305,ChIJ58tGpx35ei4RUXVj8q3F-fQ,7364da084fb875f8faba60924655aeea,5,2023-11-12,Convenient and cheap,1
75887,ChIJYxwVn_f2aS4Rtiiz9HqfaGI,3971cf1a60fe203cbbbed2d54f23ac47,5,2023-08-10,"The food is great, the service is good",1
457276,ChIJ541qp5JXei4R4do_ALhWK1k,359ebe4d2b2997d8d6396c74db24db8b,5,2022-05-14,Excellent,1
393847,ChIJO8__fuVZei4RIEO4zWPygUQ,bb35bef0c594ed2ebf6aa0a40a885c5e,5,2021-05-12,"Those who want to enjoy coffee while chatting with friends, this is recommended, the place is also cool, theres no noise from vehicles,",1
450862,ChIJxdFNe5tXei4R11pTP6Y_-18,e7cbd349f0a3a8d0502328ceff03dc71,4,2020-05-14,Halfway through the night the meal was still complete,1
365260,ChIJ7RhnYtCDeC4Rnhy6ruKcq6Y,fc6986d489f35d9323536f87ca218109,5,2020-05-14,So I want to come here again,1
130155,ChIJAaL6yFtTQi4RXo1421_bj-o,b1cc0c08b9dcee8cd4b746d105b1c52b,4,2021-05-10,Affordable and there are promotions,1
44661,ChIJu4U2dBrxaS4RaUKwFgaz4Ss,8b17d1c08a6d0dee1676a2fff588a59d,5,2023-05-13,Banyak pilihan,1
413175,ChIJOaXc671Xei4R7j5CJLMrCxU,ab3c973a70dcdfd1c799cc3f0e7a2e62,5,2023-09-12,comfortable place to hang out,1
380681,ChIJJdpKLHT71y0REYqUErz8uYs,5329574ce2bab0561c41b97a4c934954,5,2023-08-14,"Recommend friendly, cool service Thx bro anam...",1
109638,ChIJ6V8nui_xaS4R69tV78QgeP4,76698d13de9eaea9e5dc1485bcea09b5,5,2024-05-04,Okay,1
310689,ChIJT2d6SCuHeC4RcWhi9oysb0o,c68c1679250585d34915c7b5a8c1c0ba,5,2024-04-21,"Good food, good mood. Love the concept; Indonesian food from different places, Modern Indonesian Traditional songs for the vibes, you killed it! Love them so much. We tried Udang Bakar Jimbaran, Mie Kari Medan, Ikan Colo-colo, Doger Bandung. Feels like traveling to different islands of Indonesia. WOW!",1
85032,ChIJxXvwLCT1aS4RvBXmLsHOTbA,f6b497fbbe4622ec7a18784782b8e3af,4,2024-04-10,Great,1
431477,ChIJww4xPmH3ei4Re7nnf6l1QY0,15c8243f900a3a0bb8de0245e48c526e,5,2021-05-12,Absorbed,1
52066,ChIJfZd3kTn0aS4RVM_hQBLAaXw,54bfb21f92c8fdef274994682ca1d709,5,2024-04-10,"Its really great. Easy parking. Comfortable place, in the city center. The service is special. The waiters are good. Im already a loyal customer. When will you get the discount????",1
464202,ChIJZRtcamdXei4R7aZX4prvfDk,554e271c62849a36dcf6925234dc8314,5,2024-05-07,"It is recommended to bring a bottle so you can maximize the facilities. For PS, the limit is 15 minutes per game.",1
161159,ChIJ68yK31P7aS4RHzIls1K9cNU,45af30a03ae92ef46c524cd0f5c1ef2b,5,2023-05-14,"Usually stop here every time there is a Big Bad Wolf. The restaurant only opened in March 2021, but has been providing catering since June last year. If you like fish, there is salmon Wellington coated in spinach cream, then wrapped in really crunchy pastry. Ask for the dill sauce to be slightly warm so that it is even more delicious. Try the salame e rucola pizza. Typical Italian thin pizza, with lots of salami topping. These two menus can make five of us still full. Cant eat if you havent eaten rice? There is pagedangan rice, the rice smells of spices like liwet, there are lots of side dishes, you cant finish it alone either. Try exotic blue, sweet tomahawk, and pineapple mojito tails which are really suege. Oh, you can park in front of the Nusantara lobby, just tell the security guarding the door. There is also a pool table if you want to hang out after eating with friends. The place is nice, a bit quiet because its not in a mall. But its still busy at night and on weekends.",1
278904,ChIJXwc9mwFDei4Rqox6pBWcD6M,8e43f22a988eb37e958e30dd1aea6fed,5,2023-12-11,"The atmosphere is nice, there are outdoor and indoor ones. Service is also friendly, serving is fast. Payment can be cash or non-cash.",1
181030,ChIJsd79JdCxaC4RxlvmgUrNNxA,837a48232053d0a188ae68f227b84157,5,2023-06-11,sangatt worth it to buy,1
